{
  "$schema": "../skill.schema.json",
  "schemaVersion": "1.1",
  "slug": "pre-qualificacao",
  "name": "Pré-qualificação",
  "description": "Entende negócio, objetivo, situação atual e momento do lead em poucas perguntas, registra cada dado no CRM e propõe o diagnóstico quando há aderência.",
  "audience": "customer",
  "status": "published",
  "objective": "Descobrir em poucas perguntas se a Major consegue ajudar — negócio, objetivo, de onde vêm os clientes hoje, momento e quem decide —, registrar cada dado assim que aparecer e propor o diagnóstico com o Júnior quando houver aderência.",
  "activation": {
    "keywords": ["preciso", "gostaria de", "quero mais", "mais clientes", "mais pacientes", "gerar leads", "leads", "tráfego", "trafego", "anúncio", "anuncio", "site", "landing page", "instagram", "google", "marketing", "automação", "automacao", "divulgar", "divulgação", "para minha empresa", "minha clínica", "minha clinica", "meu escritório", "meu escritorio", "meu consultório", "meu consultorio"],
    "negativeKeywords": ["já sou cliente", "já somos clientes"]
  },
  "routing": { "intent": "qualification", "priority": 30, "fallback": false },
  "workflow": {
    "initialStage": "necessidade",
    "stages": [
      { "id": "necessidade", "objective": "Entender o negócio e o objetivo antes de qualquer recomendação, aproveitando o que a pessoa já disse.", "requiredFields": ["segmento", "objetivo"], "allowedTools": ["knowledge.search", "crm.contact.upsert", "crm.tag.apply", "crm.deal.qualify", "conversation.handoff"], "completion": "Negócio e objetivo foram descritos pela pessoa." },
      { "id": "momento", "objective": "Entender de onde vêm os clientes hoje e se é para agora ou para mais adiante, uma pergunta por vez.", "requiredFields": ["segmento", "objetivo", "momento"], "allowedTools": ["knowledge.search", "crm.contact.upsert", "crm.tag.apply", "crm.deal.qualify", "conversation.handoff"], "completion": "Situação atual e momento estão claros." },
      { "id": "registrar", "objective": "Registrar no CRM somente o que a pessoa disse, com status e etiqueta coerentes com os critérios de aderência.", "requiredFields": ["segmento", "objetivo", "momento"], "allowedTools": ["knowledge.search", "crm.contact.upsert", "crm.tag.apply", "crm.deal.qualify", "conversation.handoff"], "completion": "A qualificação foi persistida sem inferências indevidas." },
      { "id": "encaminhar", "objective": "Propor o diagnóstico com o Júnior quando há aderência, encerrar com transparência quando não há, ou transferir quando a pessoa pedir.", "requiredFields": ["next_step"], "allowedTools": ["knowledge.search", "crm.contact.upsert", "crm.tag.apply", "crm.deal.qualify", "conversation.handoff"], "completion": "A pessoa aceitou ou recusou o próximo passo, ou foi transferida." }
    ],
    "delegatesTo": ["vendas", "solicitacao-agenda"]
  },
  "requiredFields": ["segmento", "objetivo", "momento"],
  "questions": ["Qual é o seu negócio?", "O que você quer que mude nos próximos meses?", "Hoje, de onde vêm seus clientes?", "Isso é para agora ou para mais adiante?"],
  "allowedTools": ["knowledge.search", "crm.contact.upsert", "crm.tag.apply", "crm.deal.qualify", "conversation.handoff"],
  "guardrails": ["one_question_at_a_time", "register_each_answer", "minimal_data", "no_solution_before_diagnosis", "no_announced_unexecuted_action", "no_price_or_deadline"],
  "handoff": ["requested_human", "asked_for_junior", "complaint_or_contract", "sensitive_topic", "two_unclear_turns"]
}
